### ISSUE TITLE
Indefinite continuous polling on dead node

### ISSUE THREAD

**Issue by ChristophKoerner** [valkey-io/valkey-search#111]
Hi all,

I am testing failure modes of global metadata updates with cluster-mode enabled Valkey and came across an interesting behavior of Valkey Search module. I found that if a primary fails _after_ persisting a metadata update and _after_ broadcasting the new Search metadata fingerprint on the cluster bus - but _before_ responding to any GetGlobalMetadataRequest - then the remaining healthy nodes will indefinitely poll from the failed non-reachable node. Is this behavior expected?

This issue can be reproduced via the following steps:
1. Create a cluster-mode enabled Valkey cluster with 1 primary 1 replica (with Valkey search module loaded, and coordinator enabled)
2. Block the coordinator port on the primary to ensure that no GetGlobalMetadataRequest can be served (for example via iptables)
3. Create a search index on the primary
4. Terminate the primary
5. Observe the requests to the coordinator port of the terminated primary (for example via tcpdump)

**Comment by murphyjacob4** [comment]
Hi Christoph, thanks for the report.

How are you observing requests to the coordinator port? Is it just over tcpdump? Or is there some application level logging

We have a retry policy configured for RPCs that should result in 5 retries before the nodes give up. I am curious if the traffic you are seeing is the RPC being retried, or perhaps just the gRPC channel to the outbound node attempting to be re-established by the gRPC core

**Comment by QuChen88** [comment]
We just discussed this on the call... 

One idea to fix this is that we can implement a timeout mechanism so that nodes stop trying to reach the node which was trying to broadcast a new config after some time and try to get the config info from other nodes. If the node dies before the change gets broadcasted out then it is OK to lose the change.

**Comment by murphyjacob4** [comment]
@QuChen88 - the RPC already has a deadline and shouldn't be retried indefinitely:

https://github.com/valkey-io/valkey-search/blob/eff3e03bfad48f929863d5e5547e80a662692272/src/coordinator/client.cc#L58-L75

This is why I am wondering - is the RPC being retried? Or what is the observed symptom? If you see it in tcpdump - can you share the tcpdump? Thanks!

**Comment by ChristophKoerner** [comment]
I have not observed any application level logs.

> I am curious if the traffic you are seeing is the RPC being retried, or perhaps just the gRPC channel to the outbound node attempting to be re-established by the gRPC core

This could certainly be the case, I am seeing SYNC packets to the coordinator port. Example tcpdump:

```
13:18:55.068437 IP 10.31.0.20.28138 > 10.31.29.69.26673: Flags [S], seq 1086708899, win 26883, options [mss 8961,sackOK,TS val 2251118467 ecr 0,nop,wscale 7], length 0
13:18:56.074210 IP 10.31.0.20.28138 > 10.31.29.69.26673: Flags [S], seq 1086708899, win 26883, options [mss 8961,sackOK,TS val 2251119473 ecr 0,nop,wscale 7], length 0
13:18:58.090208 IP 10.31.0.20.28138 > 10.31.29.69.26673: Flags [S], seq 1086708899, win 26883, options [mss 8961,sackOK,TS val 2251121489 ecr 0,nop,wscale 7], length 0
13:19:02.314218 IP 10.31.0.20.28138 > 10.31.29.69.26673: Flags [S], seq 1086708899, win 26883, options [mss 8961,sackOK,TS val 2251125713 ecr 0,nop,wscale 7], length 0
13:19:10.506219 IP 10.31.0.20.28138 > 10.31.29.69.26673: Flags [S], seq 1086708899, win 26883, options [mss 8961,sackOK,TS val 2251133905 ecr 0,nop,wscale 7], length 0
13:19:15.070031 IP 10.31.0.20.24674 > 10.31.29.69.26673: Flags [S], seq 1981853799, win 26883, options [mss 8961,sackOK,TS val 2251138469 ecr 0,nop,wscale 7], length 0
13:19:16.074208 IP 10.31.0.20.24674 > 10.31.29.69.26673: Flags [S], seq 1981853799, win 26883, options [mss 8961,sackOK,TS val 2251139473 ecr 0,nop,wscale 7], length 0
13:19:18.090216 IP 10.31.0.20.24674 > 10.31.29.69.26673: Flags [S], seq 1981853799, win 26883, options [mss 8961,sackOK,TS val 2251141489 ecr 0,nop,wscale 7], length 0
13:19:22.282210 IP 10.31.0.20.24674 > 10.31.29.69.26673: Flags [S], seq 1981853799, win 26883, options [mss 8961,sackOK,TS val 2251145681 ecr 0,nop,wscale 7], length 0
13:19:30.474216 IP 10.31.0.20.24674 > 10.31.29.69.26673: Flags [S], seq 1981853799, win 26883, options [mss 8961,sackOK,TS val 2251153873 ecr 0,nop,wscale 7], length 0
```

This is ongoing indefinitely (observed for multiple days) to nodes that no longer exist in the cluster.

**Comment by yairgott** [comment]
@murphyjacob4 , I think that setting connect timeout should be set differently using OSS grpc, see: https://github.com/dmlc/xgboost/blob/2fad970c38fbbfe5aa4b9011cdb47b5ae3775efe/plugin/federated/federated_comm.cc#L57

**Comment by murphyjacob4** [comment]
> This could certainly be the case, I am seeing SYN packets to the coordinator port.

Gotcha. This makes much more sense. I think the channels are not currently destructed ever: https://github.com/valkey-io/valkey-search/blob/main/src/coordinator/client_pool.h

Probably we need a callback that when a node enters fail state or is removed from the cluster topology, we destruct the channel

**Comment by yairgott** [comment]
@murphyjacob4 , to confirm my understanding, those syn packets are **not** associated with any grpc request but probably related to grpc connection pool trying to pre-establish a connection, right?

**Comment by murphyjacob4** [comment]
> those syn packets are not associated with any grpc request but probably related to grpc connection pool

This is my assumption. But it requires further validation to validate
